{
  "schema": 1,
  "kind": "profile",
  "fidelity": "heuristic-unverified",
  "game": {
    "id": "example",
    "name": "Example Game"
  },
  "stage": [
    {
      "role": "client",
      "lifecycle": "session",
      "terminal": true,
      "match": {
        "exe": "example.exe"
      }
    }
  ],
  "technologies": []
}
